{
  "schema_version": "sales_outcome_row/v1",
  "row_id": "d4e5f6a7-b8c9-0123-defa-234567890123",
  "benchmark_spec_id": "bspec-sales-unsub-2024-q4",
  "eval_id": "eval-sales-unsub-run-001",
  "model_id": "model-outreach-v3",
  "campaign_id": "campaign-enterprise-q4-2024",
  "unit_id": "msg-prospect-66554433-002",
  "unit_of_analysis": "prospect_message",
  "measurement_policy": "online_ab",
  "metric_name": "sales:unsubscribe_rate",
  "scorer_ref": "sales:unsubscribe_rate",
  "message_count": 1,
  "delivered_count": 1,
  "numerator": 1,
  "denominator": 1,
  "observed_at": "2024-11-10T12:00:00Z",
  "label_status": "observed",
  "prospect_id": "prospect-66554433",
  "message_id": "msg-66554433-002",
  "arm": "control",
  "label_observed_at": "2024-11-10T12:00:00Z",
  "label_available_at": "2024-11-17T12:00:00Z",
  "outcome_window_days": 7,
  "coverage_fraction": 0.97,
  "unsubscribe": true,
  "source_system": "outreach"
}
