{
  "schema_version": "sales_outcome_row/v1",
  "row_id": "a1b2c3d4-e5f6-7890-abcd-ef1234567890",
  "benchmark_spec_id": "bspec-sales-qm-2024-q4",
  "eval_id": "eval-sales-qm-run-001",
  "model_id": "model-outreach-v3",
  "campaign_id": "campaign-enterprise-q4-2024",
  "unit_id": "prospect-conv-88776655",
  "unit_of_analysis": "prospect_conversation",
  "measurement_policy": "online_ab",
  "metric_name": "sales:qualified_meeting_rate",
  "scorer_ref": "sales:qualified_meeting_rate",
  "message_count": 3,
  "delivered_count": 3,
  "numerator": 1,
  "denominator": 1,
  "observed_at": "2024-11-15T14:30:00Z",
  "label_status": "observed",
  "prospect_id": "prospect-88776655",
  "conversation_id": "conv-88776655-001",
  "arm": "treatment",
  "label_observed_at": "2024-11-15T09:00:00Z",
  "label_available_at": "2024-11-29T14:30:00Z",
  "outcome_window_days": 14,
  "coverage_fraction": 1.0,
  "qualified_meeting": true,
  "source_system": "salesforce"
}
