{
  "schema_version": "sales_outcome_row/v1",
  "row_id": "b2c3d4e5-f6a7-8901-bcde-f12345678901",
  "benchmark_spec_id": "bspec-sales-rev-2024-q4",
  "eval_id": "eval-sales-rev-run-001",
  "model_id": "model-outreach-v3",
  "campaign_id": "campaign-enterprise-q4-2024",
  "unit_id": "msg-prospect-99887766-001",
  "unit_of_analysis": "prospect_message",
  "measurement_policy": "exact_observed_output",
  "metric_name": "sales:revenue_per_1000_messages",
  "scorer_ref": "sales:revenue_per_1000_messages",
  "message_count": 1,
  "delivered_count": 1,
  "numerator": 1250.0,
  "denominator": 1,
  "observed_at": "2024-11-20T16:45:00Z",
  "label_status": "observed",
  "prospect_id": "prospect-99887766",
  "message_id": "msg-99887766-001",
  "output_sha256": "0xabcdef1234567890abcdef1234567890abcdef1234567890abcdef1234567890",
  "label_observed_at": "2024-11-18T11:00:00Z",
  "label_available_at": "2024-12-04T16:45:00Z",
  "outcome_window_days": 14,
  "coverage_fraction": 1.0,
  "revenue_amount_cents": 125000,
  "revenue_currency": "USD",
  "source_system": "salesforce"
}
