{
  "schema_version": "sales_outcome_row/v1",
  "row_id": "99d479c5-d733-4553-b24d-3af9a6db1514",
  "benchmark_spec_id": "bspec-sales-lead-scoring-launch-v1",
  "eval_id": "eval-sales-lead-scoring-launch-001",
  "model_id": "sales-lead-scorer-launch",
  "campaign_id": "campaign-launch-enterprise-001",
  "unit_id": "prospect-conv-1002",
  "unit_of_analysis": "prospect_conversation",
  "measurement_policy": "online_ab",
  "metric_name": "sales:qualified_meeting_rate",
  "scorer_ref": "sales:qualified_meeting_rate",
  "message_count": 2,
  "delivered_count": 2,
  "numerator": 0,
  "denominator": 1,
  "observed_at": "2026-05-01T16:00:00Z",
  "label_status": "observed",
  "prospect_id": "prospect-1002",
  "conversation_id": "conv-1002",
  "arm": "treatment",
  "label_observed_at": "2026-05-01T15:40:00Z",
  "label_available_at": "2026-05-15T16:00:00Z",
  "outcome_window_days": 14,
  "coverage_fraction": 1.0,
  "qualified_meeting": false,
  "source_system": "salesforce"
}
