{
  "schema_version": "sales_outcome_row/v1",
  "row_id": "c3d4e5f6-a7b8-9012-cdef-123456789012",
  "benchmark_spec_id": "bspec-sales-spam-2024-q4",
  "eval_id": "eval-sales-spam-run-001",
  "model_id": "model-outreach-v3",
  "campaign_id": "campaign-enterprise-q4-2024",
  "unit_id": "msg-prospect-77665544-003",
  "unit_of_analysis": "prospect_message",
  "measurement_policy": "online_ab",
  "metric_name": "sales:spam_complaint_rate",
  "scorer_ref": "sales:spam_complaint_rate",
  "message_count": 1,
  "delivered_count": 1,
  "numerator": 0,
  "denominator": 1,
  "observed_at": "2024-11-12T08:15:00Z",
  "label_status": "observed",
  "prospect_id": "prospect-77665544",
  "message_id": "msg-77665544-003",
  "arm": "treatment",
  "label_observed_at": "2024-11-12T08:15:00Z",
  "label_available_at": "2024-11-19T08:15:00Z",
  "outcome_window_days": 7,
  "coverage_fraction": 0.98,
  "spam_complaint": false,
  "source_system": "hubspot"
}
